region,label,source,coverage_pct,mean_signal_0_255,note
chamber_wall_interaction,RESONANCE CHAMBER,/home/bb/code/godot_xPRIMEray/output/wormhole_structure_observatory/20260514T045629Z/panels/domain_diagnostics/domain_diagnostics_film.boundary_confidence.png,33.572,51.382,high boundary-crossing density or placeholder wall interaction
resonant_core,RESONANCE CHAMBER,/home/bb/code/godot_xPRIMEray/output/wormhole_structure_observatory/20260514T045629Z/panels/clean_curved/figures/figure_C_ring_density.png,21.027,47.723,throat-event pixels or portal ring-density core
phase_accumulation,PHASE BUILDUP,/home/bb/code/godot_xPRIMEray/output/wormhole_structure_observatory/20260514T045629Z/panels/clean_curved/wormhole_portal_sector_report.json; /home/bb/code/godot_xPRIMEray/output/wormhole_structure_observatory/20260514T045629Z/panels/step_budget_heatmap/step_budget_heatmap_film.png,28.467,38.567,repeated path density or high precision / step budget signal
ownership_transition,OWNERSHIP TRANSITION,/home/bb/code/godot_xPRIMEray/output/wormhole_structure_observatory/20260514T045629Z/panels/domain_diagnostics/domain_diagnostics_film.domain_id.png; /home/bb/code/godot_xPRIMEray/output/wormhole_structure_observatory/20260514T045629Z/panels/domain_diagnostics/domain_diagnostics_film.selection_flip.png,31.490,39.636,outside to chamber to exit ownership transition
inbound_packet,INBOUND PACKET,fixture-space left-to-throat transport prior,21.658,21.243,soft visual guide for inbound transport region
tunnel_exit,TUNNEL EXIT,fixture-space throat-to-right plume prior,24.163,22.816,soft visual guide for tunnel plume / exit region
